============================= test session starts ==============================
platform linux -- Python 3.12.3, pytest-9.0.2, pluggy-1.6.0
rootdir: /home/tomo/project/ac-cdd
configfile: pyproject.toml
plugins: hypothesis-6.148.7, logfire-4.16.0, langsmith-0.4.59, asyncio-1.3.0, cov-7.0.0, anyio-4.12.0
asyncio: mode=Mode.STRICT, debug=False, asyncio_default_fixture_loop_scope=None, asyncio_default_test_loop_scope=function
collected 1 item

tests/ac_cdd/integration/test_audit_loop.py DEBUG coder_session IN: iter=0, i=1, j=1, final_fix=False
Starting Auditor...
Checking out PR: http://pr
Successfully checked out PR branch
Detected PR base branch: main
Comparing changes against base branch: main
Auditor: Found 34 changed files to review
Auditor: Reviewing 5 code files
Auditor: Final review target: 5 files (context excluded)
DEBUG: Final reviewable files: ['refactor_nodes.py', 'scripts/refactor_cli.py', 'scripts/refactor_jules.py', 'scripts/refactor_jules_client.py', 'scripts/refactor_project.py']
DEBUG: Successfully read 5 files
DEBUG: - refactor_nodes.py (3129 chars)
DEBUG: - scripts/refactor_cli.py (3415 chars)
DEBUG: - scripts/refactor_jules.py (2415 chars)
DEBUG: - scripts/refactor_jules_client.py (3808 chars)
DEBUG: - scripts/refactor_project.py (3535 chars)
Running Static Analysis (mypy, ruff)...
Static Analysis Failed. Extending feedback...
Auditor #1 Rejected. Retry 2/2.
DEBUG coder_session IN: iter=2, i=1, j=2, final_fix=False
Starting Auditor...
Checking out PR: http://pr
Successfully checked out PR branch
Detected PR base branch: main
Comparing changes against base branch: main
Auditor: Found 34 changed files to review
Auditor: Reviewing 5 code files
Auditor: Final review target: 5 files (context excluded)
DEBUG: Final reviewable files: ['refactor_nodes.py', 'scripts/refactor_cli.py', 'scripts/refactor_jules.py', 'scripts/refactor_jules_client.py', 'scripts/refactor_project.py']
DEBUG: Successfully read 5 files
DEBUG: - refactor_nodes.py (3129 chars)
DEBUG: - scripts/refactor_cli.py (3415 chars)
DEBUG: - scripts/refactor_jules.py (2415 chars)
DEBUG: - scripts/refactor_jules_client.py (3808 chars)
DEBUG: - scripts/refactor_project.py (3535 chars)
Running Static Analysis (mypy, ruff)...
Static Analysis Failed. Extending feedback...
Auditor #1 limit reached. Fixing code then moving to Auditor #2.
DEBUG coder_session IN: iter=4, i=2, j=1, final_fix=False
Starting Auditor...
Checking out PR: http://pr
Successfully checked out PR branch
Detected PR base branch: main
Comparing changes against base branch: main
Auditor: Found 34 changed files to review
Auditor: Reviewing 5 code files
Auditor: Final review target: 5 files (context excluded)
DEBUG: Final reviewable files: ['refactor_nodes.py', 'scripts/refactor_cli.py', 'scripts/refactor_jules.py', 'scripts/refactor_jules_client.py', 'scripts/refactor_project.py']
DEBUG: Successfully read 5 files
DEBUG: - refactor_nodes.py (3129 chars)
DEBUG: - scripts/refactor_cli.py (3415 chars)
DEBUG: - scripts/refactor_jules.py (2415 chars)
DEBUG: - scripts/refactor_jules_client.py (3808 chars)
DEBUG: - scripts/refactor_project.py (3535 chars)
Running Static Analysis (mypy, ruff)...
Static Analysis Failed. Extending feedback...
Auditor #2 Rejected. Retry 2/2.
DEBUG coder_session IN: iter=6, i=2, j=2, final_fix=False
Starting Auditor...
Checking out PR: http://pr
Successfully checked out PR branch
Detected PR base branch: main
Comparing changes against base branch: main
Auditor: Found 34 changed files to review
Auditor: Reviewing 5 code files
Auditor: Final review target: 5 files (context excluded)
DEBUG: Final reviewable files: ['refactor_nodes.py', 'scripts/refactor_cli.py', 'scripts/refactor_jules.py', 'scripts/refactor_jules_client.py', 'scripts/refactor_project.py']
DEBUG: Successfully read 5 files
DEBUG: - refactor_nodes.py (3129 chars)
DEBUG: - scripts/refactor_cli.py (3415 chars)
DEBUG: - scripts/refactor_jules.py (2415 chars)
DEBUG: - scripts/refactor_jules_client.py (3808 chars)
DEBUG: - scripts/refactor_project.py (3535 chars)
Running Static Analysis (mypy, ruff)...
Static Analysis Failed. Extending feedback...
Auditor #2 limit reached. Fixing code then moving to Auditor #3.
DEBUG coder_session IN: iter=8, i=3, j=1, final_fix=False
Starting Auditor...
Checking out PR: http://pr
Successfully checked out PR branch
Detected PR base branch: main
Comparing changes against base branch: main
Auditor: Found 34 changed files to review
Auditor: Reviewing 5 code files
Auditor: Final review target: 5 files (context excluded)
DEBUG: Final reviewable files: ['refactor_nodes.py', 'scripts/refactor_cli.py', 'scripts/refactor_jules.py', 'scripts/refactor_jules_client.py', 'scripts/refactor_project.py']
DEBUG: Successfully read 5 files
DEBUG: - refactor_nodes.py (3129 chars)
DEBUG: - scripts/refactor_cli.py (3415 chars)
DEBUG: - scripts/refactor_jules.py (2415 chars)
DEBUG: - scripts/refactor_jules_client.py (3808 chars)
DEBUG: - scripts/refactor_project.py (3535 chars)
Running Static Analysis (mypy, ruff)...
Static Analysis Failed. Extending feedback...
Auditor #3 Rejected. Retry 2/2.
DEBUG coder_session IN: iter=10, i=3, j=2, final_fix=False
Starting Auditor...
Checking out PR: http://pr
